{
  "schema_version": 1,
  "address": "0x00557240",
  "proposed_name": "vertexBufferResourceInit",
  "owner": {
    "type": "UnknownObject",
    "trust": "UNKNOWN",
    "evidence_refs": []
  },
  "summary": "Object initializer: zero-fills the entire object via GlobalZeroInit_c2a0, then runs a do/while loop that initializes 8 sub-struct slots starting at this+1 (byte offset 0x4) with StructInitWithDefaultValues, advancing the slot cursor 16 dwords (0x40 bytes) per iteration, and finally zeroes the three trailing state dwords this[129]/[130]/[131] (offsets 0x204/0x208/0x20C). Returns the this pointer.",
  "local_names": {
    "v2": "sub-struct slot cursor",
    "v3": "slot loop counter"
  },
  "operations": [
    {
      "kind": "call",
      "description": "Zero-initialize the whole object via GlobalZeroInit_c2a0(this).",
      "evidence_refs": ["source:raw", "callee:0x0053C2A0"]
    },
    {
      "kind": "loop",
      "description": "Initialize exactly 8 sub-struct slots in a do/while loop; the slot cursor v2 starts at this+1 (byte offset 0x4) and advances 16 dwords (0x40 bytes) per iteration.",
      "evidence_refs": ["source:raw", "function:0x00557240"]
    },
    {
      "kind": "call",
      "description": "For each slot, call StructInitWithDefaultValues on the slot cursor v2 to populate it with default values.",
      "evidence_refs": ["source:raw", "callee:0x00553DB0"]
    },
    {
      "kind": "assignment",
      "description": "Zero the trailing state dword this[129] (offset 0x204).",
      "evidence_refs": ["source:raw", "field:this:0x00000204"]
    },
    {
      "kind": "assignment",
      "description": "Zero the trailing state dword this[130] (offset 0x208).",
      "evidence_refs": ["source:raw", "field:this:0x00000208"]
    },
    {
      "kind": "assignment",
      "description": "Zero the trailing state dword this[131] (offset 0x20C).",
      "evidence_refs": ["source:raw", "field:this:0x0000020C"]
    },
    {
      "kind": "return",
      "description": "Return the this pointer unchanged.",
      "evidence_refs": ["function:0x00557240", "source:raw"]
    }
  ],
  "clean_pseudocode": [
    "_DWORD* vertexBufferResourceInit(_DWORD* this) {",
    "  GlobalZeroInit_c2a0(this);",
    "  _DWORD* slot = this + 1;",
    "  int count = 8;",
    "  do {",
    "    StructInitWithDefaultValues(slot);",
    "    slot += 16;",
    "  } while (--count);",
    "  this[129] = 0;",
    "  this[130] = 0;",
    "  this[131] = 0;",
    "  return this;",
    "}"
  ],
  "unresolved": [
    "The semantic role of the 8 sub-struct slots (existing analysis and the caller VertexBufferResourceAllocation suggest vertex buffer resources) is DERIVED, not confirmed by this packet.",
    "The meanings of the three zeroed trailing fields at 0x204/0x208/0x20C are unknown.",
    "The owner object type of this struct is unidentified; owner is UnknownObject."
  ],
  "unresolved_evidence_refs": [
    "abi:lead",
    "caller:0x00543FA0"
  ],
  "confidence": {
    "semantics": "HIGH",
    "owner": "LOW",
    "control_flow": "HIGH"
  }
}
