{
  "schema_version": 1,
  "address": "0x00542490",
  "proposed_name": "GetThreeFields",
  "owner": {
    "type": "UnknownObject",
    "trust": "UNKNOWN",
    "evidence_refs": ["function:0x00542490"]
  },
  "summary": "__thiscall three-field getter. Each output pointer is individually null-guarded: if a2 is non-null write *a2 = this[12] (this+0x30); if a3 is non-null write *a3 = this[13] (this+0x34); if a4 is non-null write *a4 = this[14] (this+0x38). Returns a4 (the last output pointer). No callees, no globals. Called by TwoCallDelegation_2420 (00542420) and sub_558E70 (00558e70). Prior analysis labels the three source fields as orientation angles / facing components (DERIVED, not proven by this packet).",
  "local_names": {
    "this": "object whose dwords at offsets 0x30, 0x34, 0x38 are read",
    "a2": "optional output pointer for field this+0x30",
    "a3": "optional output pointer for field this+0x34",
    "a4": "optional output pointer for field this+0x38, also the return value",
    "result": "return value, always a4"
  },
  "operations": [
    {
      "kind": "guard",
      "description": "Guard: if a2 is non-null, copy the field at this+0x30 into *a2.",
      "evidence_refs": ["field:this:0x00000030", "source:raw"]
    },
    {
      "kind": "assignment",
      "description": "*a2 = this[12], i.e. dword at this+0x30.",
      "evidence_refs": ["field:this:0x00000030", "source:raw"]
    },
    {
      "kind": "guard",
      "description": "Guard: if a3 is non-null, copy the field at this+0x34 into *a3.",
      "evidence_refs": ["field:this:0x00000034", "source:raw"]
    },
    {
      "kind": "assignment",
      "description": "*a3 = this[13], i.e. dword at this+0x34.",
      "evidence_refs": ["field:this:0x00000034", "source:raw"]
    },
    {
      "kind": "assignment",
      "description": "result = a4 (return value is preloaded with a4 before the last guarded write).",
      "evidence_refs": ["source:raw"]
    },
    {
      "kind": "guard",
      "description": "Guard: if a4 is non-null, copy the field at this+0x38 into *a4.",
      "evidence_refs": ["field:this:0x00000038", "source:raw"]
    },
    {
      "kind": "assignment",
      "description": "*a4 = this[14], i.e. dword at this+0x38.",
      "evidence_refs": ["field:this:0x00000038", "source:raw"]
    },
    {
      "kind": "return",
      "description": "Return a4 (the last output pointer).",
      "evidence_refs": ["function:0x00542490", "source:raw"]
    },
    {
      "kind": "call",
      "description": "Invoked by TwoCallDelegation_2420 (00542420).",
      "evidence_refs": ["caller:0x00542420"]
    },
    {
      "kind": "call",
      "description": "Invoked by sub_558E70 (00558e70).",
      "evidence_refs": ["caller:0x00558E70"]
    }
  ],
  "clean_pseudocode": [
    "DWORD *GetThreeFields(DWORD *this, DWORD *a2, DWORD *a3, DWORD *a4) {",
    "  if (a2) *a2 = this[12];",
    "  if (a3) *a3 = this[13];",
    "  if (a4) *a4 = this[14];",
    "  return a4;",
    "}"
  ],
  "unresolved": [
    "The semantic meaning of the three source dwords (this+0x30/0x34/0x38) is labeled as orientation/facing by prior analysis but is not proven by this packet.",
    "Why the return value is the last output pointer a4 rather than void or a status code is unexplained by the packet."
  ],
  "unresolved_evidence_refs": [],
  "confidence": {
    "semantics": "HIGH",
    "owner": "LOW",
    "control_flow": "HIGH"
  }
}
