{
  "schema_version": 1,
  "address": "0x0049AFC0",
  "proposed_name": "CleanupCallbackRegister",
  "owner": {
    "type": "UnknownObject",
    "trust": "UNKNOWN",
    "evidence_refs": []
  },
  "summary": "Thin wrapper: calls EmptyStub_0170 with the global dword_7CE048 (0x007CE048) as its argument and returns the result. The raw source shows only this single call/return; the global's content and the stub's behavior are not established by packet evidence.",
  "local_names": {},
  "operations": [
    {
      "kind": "call",
      "description": "Invoke EmptyStub_0170 passing the global dword_7CE048 (0x007CE048) as the argument.",
      "evidence_refs": ["global:0x007CE048", "source:raw"]
    },
    {
      "kind": "return",
      "description": "Return the result of the EmptyStub_0170 call.",
      "evidence_refs": ["source:raw"]
    }
  ],
  "clean_pseudocode": [
    "int CleanupCallbackRegister() {",
    "  return EmptyStub_0170(&dword_7CE048);",
    "}"
  ],
  "unresolved": [
    "dword_7CE048 is unnamed; its type, content, and purpose are unknown.",
    "EmptyStub_0170 is named only in the raw source text; it is absent from the packet callees list, so no callee address or semantic contract is available.",
    "The ABI lead name CleanupCallbackRegister suggests a cleanup-callback registration role, but it is not corroborated by the raw source evidence.",
    "No callers or owner evidence exist."
  ],
  "unresolved_evidence_refs": ["abi:lead"],
  "confidence": {
    "semantics": "MEDIUM",
    "owner": "LOW",
    "control_flow": "HIGH"
  }
}
