{
  "schema_version": 1,
  "address": "0x00408290",
  "proposed_name": "StateInitWithGlobalConstants",
  "owner": {
    "type": "UnknownObject",
    "trust": "UNKNOWN",
    "evidence_refs": []
  },
  "summary": "Initializes struct state from two global DWORD constants plus a fixed flag: calls StructInitWithConditionalNotify first and captures its result, writes dword_5D6D60 cast to float into this+0xC, writes dword_5D6D64 (loaded via a double) cast to float into this+0x10, sets the byte at this+0x14 to 1, and returns the StructInitWithConditionalNotify result. Called by CamMan_Restart to re-initialize state; the globals are proposed as screen width/height only in the skeleton fill (DERIVED).",
  "local_names": {
    "widthFloat": "float at this+0xC, initialized from dword_5D6D60 (proposed ScreenWidth, DERIVED)",
    "heightFloat": "float at this+0x10, initialized from dword_5D6D64 (proposed ScreenHeight, DERIVED)",
    "enabledFlag": "byte at this+0x14, set to 1"
  },
  "operations": [
    {
      "kind": "call",
      "description": "Calls StructInitWithConditionalNotify and stores its return value as this function's result.",
      "evidence_refs": ["callee:0x004083E0", "source:raw"]
    },
    {
      "kind": "assignment",
      "description": "Writes dword_5D6D60 cast to float into this+0xC.",
      "evidence_refs": ["field:this:0x0000000C", "global:0x005D6D60", "source:raw"]
    },
    {
      "kind": "calculation",
      "description": "Loads dword_5D6D64 into a double register in preparation for the float store.",
      "evidence_refs": ["global:0x005D6D64", "source:raw"]
    },
    {
      "kind": "assignment",
      "description": "Writes dword_5D6D64 (via the double load) cast to float into this+0x10.",
      "evidence_refs": ["field:this:0x00000010", "global:0x005D6D64", "source:raw"]
    },
    {
      "kind": "assignment",
      "description": "Sets the byte at this+0x14 to 1 (active/enabled flag).",
      "evidence_refs": ["field:this:0x00000014", "source:raw"]
    },
    {
      "kind": "return",
      "description": "Returns the result captured from StructInitWithConditionalNotify.",
      "evidence_refs": ["function:0x00408290", "callee:0x004083E0", "source:raw"]
    }
  ],
  "clean_pseudocode": [
    "int StateInitWithGlobalConstants(int this) {",
    "  int result = StructInitWithConditionalNotify();",
    "  *(float *)(this + 12) = (float)dword_5D6D60;",
    "  double v3 = (double)dword_5D6D64;",
    "  *(_BYTE *)(this + 20) = 1;",
    "  *(float *)(this + 16) = v3;",
    "  return result;",
    "}"
  ],
  "unresolved": [
    "dword_5D6D60 and dword_5D6D64 are proposed as ScreenWidth/ScreenHeight only in the skeleton fill (DERIVED); the packet itself does not evidence their semantic role.",
    "StructInitWithConditionalNotify's behavior and what the this+0x14 flag (set to 1) enables are not evidenced."
  ],
  "unresolved_evidence_refs": [],
  "confidence": {
    "semantics": "MEDIUM",
    "owner": "LOW",
    "control_flow": "HIGH"
  }
}
