{
  "schema_version": 1,
  "address": "0x00567A90",
  "proposed_name": "RecursiveTreeTraversalFree",
  "owner": {
    "type": "UnknownObject",
    "trust": "UNKNOWN",
    "evidence_refs": []
  },
  "summary": "Recursively frees a tree/graph structure rooted at a1. Validates the root with NullCheckWrapper, walks the child list through each node's second dword (sibling/next pointer) and recurses on every node, then derives a secondary sub-object with ShortComputation_adb0 and recurses on it if present. Finally runs DualPointerCleanup on the root and releases it with FreeWrapper_7bcf.",
  "operations": [
    {
      "kind": "guard",
      "description": "Do nothing unless the root pointer a1 is non-null.",
      "evidence_refs": ["source:raw"]
    },
    {
      "kind": "call",
      "description": "Validate the root node with NullCheckWrapper(a1, 0); the walk cursor is seeded from its result.",
      "evidence_refs": ["callee:0x005679A0", "source:raw"]
    },
    {
      "kind": "loop",
      "description": "Walk the child/sibling list while the cursor v2 is non-null, advancing through each node's second dword (v2[1]) as the next link.",
      "evidence_refs": ["source:raw"]
    },
    {
      "kind": "call",
      "description": "Recurse on each node of the child list, freeing it via the same routine.",
      "evidence_refs": ["callee:0x00567A90", "source:raw"]
    },
    {
      "kind": "call",
      "description": "Derive a secondary sub-object pointer from the root a1 via ShortComputation_adb0(a1).",
      "evidence_refs": ["callee:0x0049ADB0", "source:raw"]
    },
    {
      "kind": "guard",
      "description": "If the derived secondary sub-object v4 is non-null, free it recursively.",
      "evidence_refs": ["source:raw"]
    },
    {
      "kind": "call",
      "description": "Recurse on the secondary sub-object v4 through the same free routine.",
      "evidence_refs": ["callee:0x00567A90", "source:raw"]
    },
    {
      "kind": "call",
      "description": "Run DualPointerCleanup(a1) on the root to release its dual-pointer members.",
      "evidence_refs": ["callee:0x00567940", "source:raw"]
    },
    {
      "kind": "call",
      "description": "Release the root node's memory with FreeWrapper_7bcf(a1).",
      "evidence_refs": ["callee:0x00587BCF", "source:raw"]
    }
  ],
  "clean_pseudocode": [
    "void RecursiveTreeTraversalFree(_DWORD* root) {",
    "  if (!root) return;",
    "  NullCheckWrapper(root, 0);",
    "  _DWORD* cursor = root;",
    "  while (cursor) {",
    "    _DWORD* node = cursor;",
    "    cursor = (_DWORD*)cursor[1];",
    "    RecursiveTreeTraversalFree(node);",
    "  }",
    "  _DWORD* sub = (_DWORD*)ShortComputation_adb0(root);",
    "  if (sub) RecursiveTreeTraversalFree(sub);",
    "  DualPointerCleanup((int)root);",
    "  FreeWrapper_7bcf(root);",
    "}"
  ],
  "unresolved": [
    "Node structure is unknown: the meaning of the second dword link and the object returned by ShortComputation_adb0 depend on an unevidenced owner layout.",
    "The decompiled source's `v1` (NullCheckWrapper result) is an uninitialized-looking register alias; the walk cursor is treated as derived from the validated root.",
    "Relation of DualPointerCleanup/FreeWrapper_7bcf ownership is caller-specific and not evidenced here."
  ],
  "unresolved_evidence_refs": [],
  "confidence": {
    "semantics": "HIGH",
    "owner": "LOW",
    "control_flow": "HIGH"
  }
}
