{
  "schema_version": 1,
  "address": "0x004CF040",
  "proposed_name": "RepeatedCallLoop",
  "owner": {
    "type": "UnknownObject",
    "trust": "UNKNOWN",
    "evidence_refs": []
  },
  "summary": "Iterates a strided array owned by `this` and calls sub_4CB5E0 once per element. The element count is read from this+0x10; the first element pointer is read from this+0x14; consecutive elements are 108 bytes apart. When the count is not positive the loop is skipped and the function returns the count.",
  "operations": [
    {
      "kind": "assignment",
      "description": "Read the element count from this+0x10 into result and seed the loop counter.",
      "evidence_refs": ["source:raw", "field:this:0x00000010"]
    },
    {
      "kind": "guard",
      "description": "Proceed only when the count is positive; otherwise the loop body never runs.",
      "evidence_refs": ["source:raw"]
    },
    {
      "kind": "loop",
      "description": "do-while loop that runs until the per-iteration counter reaches the element count.",
      "evidence_refs": ["source:raw", "field:this:0x00000010"]
    },
    {
      "kind": "call",
      "description": "Call sub_4CB5E0 on each element: base pointer from this+0x14 plus the current strided index.",
      "evidence_refs": ["callee:0x004CB5E0", "field:this:0x00000014"]
    },
    {
      "kind": "calculation",
      "description": "Advance the element index by 108 bytes after each call.",
      "evidence_refs": ["source:raw"]
    },
    {
      "kind": "return",
      "description": "Return the element count read from this+0x10.",
      "evidence_refs": ["source:raw"]
    }
  ],
  "clean_pseudocode": [
    "int RepeatedCallLoop(DWORD *this) {",
    "  int count = this[4];",
    "  int i = 0;",
    "  if (count > 0) {",
    "    int off = 0;",
    "    do { sub_4CB5E0(this[5] + off); off += 108; ++i; } while (i < count);",
    "  }",
    "  return count;",
    "}"
  ],
  "unresolved": [
    "Identity and purpose of the owner object are unknown.",
    "Element type and semantics of the 108-byte stride depend on the caller's array layout.",
    "Purpose and behavior of callee sub_4CB5E0 are unknown here."
  ],
  "unresolved_evidence_refs": [],
  "confidence": {
    "semantics": "HIGH",
    "owner": "LOW",
    "control_flow": "HIGH"
  }
}
