{
  "schema_version": 1,
  "address": "0x004A0430",
  "proposed_name": "SessionModeUIPageDispatch",
  "owner": {
    "type": "UnknownObject",
    "trust": "UNKNOWN",
    "evidence_refs": ["abi:lead", "function:0x004A0430"]
  },
  "summary": "Dispatches a UI page lookup based on the mode value at dword_7D0410. Modes up to 4 open the monitor page (aMonitorpage); mode 5 opens either the multiplayer host grid (aMphostgrid) or client grid (aMpclientgrid) depending on StateCheckWrapper's result for the module manager at dword_7CD25C. All page lookups go through LookupDispatch with the dispatch interface pointer at dword_7CD8C0 and a -1 flag; every path returns 0.",
  "local_names": {},
  "operations": [
    {
      "kind": "guard",
      "description": "When the mode value at dword_7D0410 is not positive the function returns 0 immediately without any dispatch",
      "evidence_refs": ["global:0x007D0410", "source:raw"]
    },
    {
      "kind": "guard",
      "description": "When the mode value at dword_7D0410 is at most 4 the monitor page path is taken",
      "evidence_refs": ["global:0x007D0410", "source:raw"]
    },
    {
      "kind": "call",
      "description": "LookupDispatch opens the monitor page name aMonitorpage through the dispatch interface at dword_7CD8C0 with a -1 flag, then returns 0",
      "evidence_refs": ["callee:0x00497940", "global:0x005C6BD4", "global:0x007CD8C0", "source:raw"]
    },
    {
      "kind": "guard",
      "description": "When the mode value at dword_7D0410 is not exactly 5 the function returns 0 without any dispatch",
      "evidence_refs": ["global:0x007D0410", "source:raw"]
    },
    {
      "kind": "call",
      "description": "StateCheckWrapper tests the module manager state at dword_7CD25C to decide between the host and client grid page",
      "evidence_refs": ["callee:0x00461DC0", "global:0x007CD25C", "source:raw"]
    },
    {
      "kind": "call",
      "description": "When the state check passes, LookupDispatch opens the multiplayer host grid page aMphostgrid through the dispatch interface at dword_7CD8C0 with a -1 flag",
      "evidence_refs": ["callee:0x00497940", "global:0x005C6BC8", "global:0x007CD8C0", "source:raw"]
    },
    {
      "kind": "call",
      "description": "When the state check fails, LookupDispatch opens the multiplayer client grid page aMpclientgrid through the dispatch interface at dword_7CD8C0 with a -1 flag",
      "evidence_refs": ["callee:0x00497940", "global:0x005C5F5C", "global:0x007CD8C0", "source:raw"]
    },
    {
      "kind": "return",
      "description": "Every control-flow path returns 0",
      "evidence_refs": ["function:0x004A0430", "source:raw"]
    }
  ],
  "clean_pseudocode": [
    "if (dword_7D0410 <= 0) return 0;",
    "if (dword_7D0410 <= 4) {",
    "  LookupDispatch(dword_7CD8C0, aMonitorpage, -1);",
    "  return 0;",
    "}",
    "if (dword_7D0410 != 5) return 0;",
    "if (StateCheckWrapper(dword_7CD25C))",
    "  LookupDispatch(dword_7CD8C0, aMphostgrid, -1);",
    "else",
    "  LookupDispatch(dword_7CD8C0, aMpclientgrid, -1);",
    "return 0;"
  ],
  "unresolved": [
    "The exact page-name strings aMonitorpage, aMphostgrid and aMpclientgrid are string globals; their full literal content is not present in this packet",
    "The -1 flag meaning passed to LookupDispatch and the details of StateCheckWrapper's state check are not documented in this packet"
  ],
  "unresolved_evidence_refs": [],
  "confidence": {
    "semantics": "HIGH",
    "owner": "LOW",
    "control_flow": "HIGH"
  }
}
