{
  "schema_version": 1,
  "address": "0x004B9F89",
  "proposed_name": "GetFieldF8C",
  "owner": {
    "type": "UnknownObject",
    "trust": "UNKNOWN",
    "evidence_refs": ["function:0x004B9F89"]
  },
  "summary": "Trivial getter: reads the DWORD at this+0xF8C and returns it. No side effects, no guard, no callees.",
  "operations": [
    {
      "kind": "return",
      "description": "Return the DWORD read at this+0xF8C (offset 3980 from the __usercall argument a1).",
      "evidence_refs": ["field:this:0x00000F8C", "source:raw"]
    }
  ],
  "clean_pseudocode": [
    "int sub_4B9F89(int a1) {",
    "  return *(int *)(a1 + 3980);",
    "}"
  ],
  "unresolved": [
    "The owning class of this is unknown; the semantic role of field 0xF8C is not grounded in this packet."
  ],
  "unresolved_evidence_refs": [],
  "confidence": {
    "semantics": "HIGH",
    "owner": "LOW",
    "control_flow": "HIGH"
  }
}
