{
  "schema_version": 1,
  "address": "0x00582360",
  "proposed_name": "RecreateMutex",
  "owner": {
    "type": "UnknownObject",
    "trust": "UNKNOWN",
    "evidence_refs": ["source:raw", "function:0x00582360"]
  },
  "summary": "Creates (or recreates) an unnamed Win32 mutex stored on the receiver. If the validity flag at this+0x18 is set, the existing handle at this+0x10 is closed via CloseHandle and, on success, zeroed. An unnamed inheritable mutex is then created with CreateMutexA using a default security-attributes structure (nLength=12, no security descriptor, inheritable), and the new handle is stored at this+0x10. On a successful create the flag at this+0x18 is set to 1. The function returns the flag value (1 = mutex ready, 0 = failed to create).",
  "operations": [
    {
      "kind": "guard",
      "description": "if (*(this+0x18) != 0 && CloseHandle(*(this+0x10))) : close the existing mutex handle only when the validity flag is set and the handle closes successfully.",
      "evidence_refs": ["field:this:0x00000018", "field:this:0x00000010", "global:0x0059E1A8", "source:raw"]
    },
    {
      "kind": "assignment",
      "description": "*(this+0x10) = 0 : zero the stored handle after the close succeeds.",
      "evidence_refs": ["field:this:0x00000010", "source:raw"]
    },
    {
      "kind": "assignment",
      "description": "Initialize the stack security-attributes structure: nLength = 12, lpSecurityDescriptor = 0, bInheritHandle = 1.",
      "evidence_refs": ["source:raw"]
    },
    {
      "kind": "call",
      "description": "v2 = CreateMutexA(&MutexAttributes, 0, 0) : create an unnamed, initially not-owned mutex with default security attributes.",
      "evidence_refs": ["global:0x0059E1AC", "source:raw"]
    },
    {
      "kind": "assignment",
      "description": "*(this+0x10) = v2 : store the new mutex handle.",
      "evidence_refs": ["field:this:0x00000010", "source:raw"]
    },
    {
      "kind": "guard",
      "description": "if (v2 != 0) : the validity flag is set only when the create succeeded.",
      "evidence_refs": ["source:raw"]
    },
    {
      "kind": "assignment",
      "description": "*(this+0x18) = 1 : mark the mutex as valid.",
      "evidence_refs": ["field:this:0x00000018", "source:raw"]
    },
    {
      "kind": "return",
      "description": "return *(this+0x18) : return the validity flag (1 = mutex ready, 0 = failed).",
      "evidence_refs": ["field:this:0x00000018", "source:raw"]
    }
  ],
  "clean_pseudocode": [
    "char sub_582360(int this) {",
    "  SECURITY_ATTRIBUTES MutexAttributes;",
    "  if (*(_BYTE *)(this + 24) && CloseHandle(*(HANDLE *)(this + 16)))",
    "    *(_DWORD *)(this + 16) = 0;",
    "  MutexAttributes.nLength = 12;",
    "  MutexAttributes.lpSecurityDescriptor = 0;",
    "  MutexAttributes.bInheritHandle = 1;",
    "  HANDLE v2 = CreateMutexA(&MutexAttributes, 0, 0);",
    "  *(_DWORD *)(this + 16) = (int)v2;",
    "  if (v2)",
    "    *(_BYTE *)(this + 24) = 1;",
    "  return *(_BYTE *)(this + 24);",
    "}"
  ],
  "unresolved": [
    "The three byte_FF0000000000545x globals (0xFF00000000005450/51/52) are reported as written by the function but do not appear in the raw decompiled source; they are treated as artifacts of stack-struct aliasing in the IDB and retained unresolved.",
    "Object identity of `this` and the synchronization role of the mutex beyond generic use of the 0x10 handle / 0x18 validity byte are unknown; callers are sub_57BA10 0x0057BA10 and sub_5837F0 0x005837F0."
  ],
  "unresolved_evidence_refs": ["abi:lead", "caller:0x0057BA10", "caller:0x005837F0", "global:0xFF00000000005450", "global:0xFF00000000005451", "global:0xFF00000000005452"],
  "confidence": {
    "semantics": "HIGH",
    "owner": "LOW",
    "control_flow": "HIGH"
  }
}
